{
  "schemaVersion": 3,
  "id": "voa-lle1",
  "title": {
    "text": "Let's Learn English - Level 1",
    "prov": { "kind": "source", "ref": "frag-title-course" }
  },
  "sourcePack": "voa-lle1-lesson1",
  "units": [
    {
      "id": "voa-lle1-unit-course",
      "title": {
        "text": "Level 1",
        "prov": { "kind": "source", "ref": "frag-title-unit" }
      },
      "lessons": [
        {
          "id": "voa-lle1-lesson-1",
          "title": {
            "text": "Lesson 1: Welcome!",
            "prov": { "kind": "source", "ref": "frag-title-lesson" }
          },
          "sections": [
            {
              "id": "s-orient",
              "function": "orient",
              "title": {
                "text": "welcome!",
                "prov": { "kind": "source", "ref": "frag-title-welcome" }
              },
              "activities": [
                {
                  "id": "orient-goals",
                  "title": {
                    "text": "Goals",
                    "prov": { "kind": "source", "ref": "frag-heading-goals" }
                  },
                  "scored": false,
                  "items": [
                    {
                      "type": "read",
                      "id": "orient-topics",
                      "blocks": [
                        { "text": "Meeting people", "prov": { "kind": "source", "ref": "frag-topic-meeting" } },
                        { "text": "Introduce yourself", "prov": { "kind": "source", "ref": "frag-topic-introduce" } }
                      ]
                    },
                    {
                      "type": "read",
                      "id": "orient-goals-list",
                      "blocks": [
                        { "text": "Grammar: Verb BE (I am) in introductions; BE + location", "prov": { "kind": "source", "ref": "frag-goal-grammar" } },
                        { "text": "Speaking: Meeting people; Ask question and answer “Are you (name)?”", "prov": { "kind": "source", "ref": "frag-goal-speaking" } },
                        { "text": "Review alphabet and numbers 1-20", "prov": { "kind": "source", "ref": "frag-goal-review" } },
                        { "text": "Pronunciation: Pronouncing linked sounds", "prov": { "kind": "source", "ref": "frag-goal-pron" } }
                      ]
                    }
                  ]
                },
                {
                  "id": "orient-set-goal",
                  "title": {
                    "text": "Learning Strategy",
                    "prov": { "kind": "source", "ref": "frag-heading-strategy" }
                  },
                  "scored": false,
                  "items": [
                    {
                      "type": "read",
                      "id": "orient-strategy",
                      "blocks": [
                        { "text": "Set a Goal", "prov": { "kind": "source", "ref": "frag-strategy-name" } },
                        {
                          "prov": {
                            "kind": "gap",
                            "ref": "frag-t-strategy-advice",
                            "note": "teacher-voice goal-setting advice withheld; awaiting editor-approved learner-facing wording"
                          }
                        }
                      ]
                    },
                    {
                      "type": "note",
                      "id": "orient-goal-note",
                      "prompt": {
                        "text": "What do you want to do in English after studying for three months?",
                        "prov": { "kind": "source", "ref": "frag-goal-question", "note": "quoted learner-facing question inside the plan's strategy step" }
                      }
                    }
                  ]
                }
              ]
            },
            {
              "id": "s-prepare",
              "function": "prepare",
              "title": {
                "text": "Teach Key Words",
                "prov": { "kind": "source", "ref": "frag-heading-teachkw" }
              },
              "activities": [
                {
                  "id": "prepare-key-words",
                  "title": {
                    "text": "Key Words",
                    "prov": { "kind": "source", "ref": "frag-heading-keywords" }
                  },
                  "scored": false,
                  "items": [
                    {
                      "type": "read",
                      "id": "kw-apartment",
                      "blocks": [
                        { "text": "apartment - n. a usually rented room or set of rooms that is part of a building and is used as a place to live", "prov": { "kind": "source", "ref": "frag-kw-apartment" } }
                      ]
                    },
                    {
                      "type": "read",
                      "id": "kw-meet",
                      "blocks": [
                        { "text": "meet - v. to see and speak to someone for the first time", "prov": { "kind": "source", "ref": "frag-kw-meet" } }
                      ]
                    },
                    {
                      "type": "read",
                      "id": "kw-new",
                      "blocks": [
                        { "text": "new - adj. not known before; recently bought or rented", "prov": { "kind": "source", "ref": "frag-kw-new" } }
                      ]
                    },
                    {
                      "type": "read",
                      "id": "kw-nice",
                      "blocks": [
                        { "text": "nice - adj. good and enjoyable", "prov": { "kind": "source", "ref": "frag-kw-nice" } }
                      ]
                    },
                    {
                      "type": "read",
                      "id": "kw-street",
                      "blocks": [
                        { "text": "street - n. a road in a city, town, or village", "prov": { "kind": "source", "ref": "frag-kw-street" } }
                      ]
                    },
                    {
                      "type": "read",
                      "id": "kw-try",
                      "blocks": [
                        { "text": "try - v. to make an effort to do something", "prov": { "kind": "source", "ref": "frag-kw-try" } }
                      ]
                    },
                    {
                      "type": "read",
                      "id": "kw-welcome",
                      "blocks": [
                        { "text": "welcome - interjection. used as a friendly greeting to someone who has arrived at a place", "prov": { "kind": "source", "ref": "frag-kw-welcome" } }
                      ]
                    }
                  ]
                },
                {
                  "id": "prepare-speaking-practice",
                  "title": {
                    "text": "Speaking Practice",
                    "prov": { "kind": "source", "ref": "frag-title-sp" }
                  },
                  "scored": false,
                  "items": [
                    {
                      "type": "media",
                      "id": "prep-sp-video",
                      "media": { "kind": "video", "src": "/media/voa-lle1/voa-lle1-speaking-practice.mp4", "sha256": "b5f4fe7107ad537c897ad5a171d114928159348202e89e3e7f554be05d58a519" },
                      "title": {
                        "text": "Speaking Practice",
                        "prov": { "kind": "source", "ref": "frag-title-sp" }
                      },
                      "transcript": {
                        "text": "Here’s how to practice.\nListen. (video recording of “apartment” plays)\nRecord yourself.\n“Apartment.”\nThen listen.\n“Apartment”",
                        "prov": { "kind": "source", "ref": "frag-sp-script" }
                      }
                    }
                  ]
                },
                {
                  "id": "prepare-letters-numbers",
                  "title": {
                    "text": "Review the Alphabet",
                    "prov": { "kind": "source", "ref": "frag-heading-alpha" }
                  },
                  "scored": false,
                  "items": [
                    {
                      "type": "read",
                      "id": "prep-alphabet",
                      "blocks": [
                        {
                          "text": "A B C D E F G H I J K L M N O P Q R S T U V W X Y Z",
                          "prov": {
                            "kind": "derived",
                            "transform": { "op": "ENUMERATE_ALPHABET", "ref": "frag-goal-review" },
                            "note": "mechanical enumeration of the letter set authorized by the verified objective 'Review alphabet and numbers 1-20'"
                          }
                        }
                      ]
                    },
                    {
                      "type": "media",
                      "id": "prep-alphabet-video",
                      "media": { "kind": "embed", "provider": "youtube", "embedSrc": "https://www.youtube.com/embed/IpIhzFh0yw8", "sourceUrl": "https://youtu.be/IpIhzFh0yw8" },
                      "title": {
                        "text": "Learn the alphabet",
                        "prov": { "kind": "source", "ref": "frag-title-page-alpha" }
                      }
                    },
                    {
                      "type": "read",
                      "id": "prep-numbers",
                      "blocks": [
                        { "text": "Numbers from 1 - 20", "prov": { "kind": "source", "ref": "frag-heading-numbers" } },
                        {
                          "text": "one, two, three, four, five, six, seven, eight, nine, ten, eleven, twelve, thirteen, fourteen, fifteen, sixteen, seventeen, eighteen, nineteen, twenty",
                          "prov": {